https://quantifiedself.com/show-and-tell/?project=333,diet and weight loss  |  sleep,Journal | phone,"Hi, I’m Rob Rothfarb and I’m going to talk a little bit about the medical tracking that I do. I’ve been tracking my personal health data as a proactive patient for many years. Empowered recently by new tools for tracking and discovery that can help me stay on top of health issues that I have, and to have productive conversations and interactions with my medical team.",https://player.vimeo.com/video/75620034?app_id=122963
https://quantifiedself.com/show-and-tell/?project=341,heart rate / cardiovascular  |  social life & social media,heart rate monitor,"Hi everyone my name is Kiel Gilleade and I’m doing a follow-up talk to the one I gave at the first Quantified Self London talk, where I presented a system called the Bodies Blogger. Now my research background is I work at John Moores University and my research background is in physiological computing. This is where we use physiological signals to drive computing systems for various means such as games, health and such.",https://player.vimeo.com/video/36278670?app_id=122963
https://quantifiedself.com/show-and-tell/?project=343,media  |  mood & emotion  |  social life & social media,Fitbit Flex | Google Sheets | Scosche Rhythm,,https://player.vimeo.com/video/103711750?app_id=122963
https://quantifiedself.com/show-and-tell/?project=345,heart rate / cardiovascular  |  stress,memory belt | pen and paper,"I have a background in measuring happiness, but I wanted to do something that can also be measured objectively. So in this tool I’m going to talk about one, how you can measure stress and I think there are two methods basically. First, it’s going to be more subjective and you can ask yourself how stressed am I on a scale of 1 to 10 or something. And the second thing is maybe you can measure it objectively. We have seen the heart rate we have seen some sort of brainwaves and there are more other ways like skin conductivity or stuff like that.",https://player.vimeo.com/video/35869898?app_id=122963
https://quantifiedself.com/show-and-tell/?project=349,chronic condition  |  diet and weight loss  |  sleep,Excel | Fitbit,,https://player.vimeo.com/video/84443953?app_id=122963
https://quantifiedself.com/show-and-tell/?project=351,heart rate / cardiovascular  |  sports & fitness,Check My Level,"So my name is Philipp Kalwies. I’m the co-founder of the meet up group in Hamburg, Germany, and today I would like to talk about measuring training often and measuring training readiness with this special QS device. It’s still not open, and it’s still very very new and that’s why I’m very excited to talk about it.",https://player.vimeo.com/video/69808656?app_id=122963
https://quantifiedself.com/show-and-tell/?project=353,productivity,floss,So about five years ago I went to the dentist and my dentist as I was leaving his office he said Nicholas remember floss the teeth if you want to keep and to keep in mind this was five years ago and this was before any of my journey of change started. And he said that to me as a kind of a throwaway line but then months later I couldn’t get it out of my head because I wanted to keep all my teeth.,https://player.vimeo.com/video/32410437?app_id=122963
https://quantifiedself.com/show-and-tell/?project=354,diet and weight loss  |  heart rate / cardiovascular  |  sleep,Excel | Fitbit,"All right, thank you Gary, thank you Ernesto, thank you everybody. Gary mentioned I was here back in January and did my first talk post diagnosis. I’ve been a Quantified Selfer since I was about this tall, but got really serious when I got diagnose about a year and a half ago.",https://player.vimeo.com/video/102199473?app_id=122963
https://quantifiedself.com/show-and-tell/?project=360,diet and weight loss  |  sports & fitness,CrossFit,,https://player.vimeo.com/video/29391391?app_id=122963
https://quantifiedself.com/show-and-tell/?project=367,productivity,Google Sheets | phone,,https://player.vimeo.com/video/98336392?app_id=122963
https://quantifiedself.com/show-and-tell/?project=372,chronic condition,video clip,", here’s what happened. I was walking through a lunch restaurant with my tray on to where you put the dishes when a thought came into my head. If I was to spot someone I recognize now I would probably fall, and I had literally not finished the though when I found myself o my kneed in the middle of the restaurant surrounded by lots of surprised people. The person that I recognized was incidentally one of the supervisors from my Ph.D. as well as a practicing neurologist and researcher came up to me and took my tray. And I stumbled back on my feet and I took a bow to acknowledge the applause I was given for not dropping my tray. I actually didn’t drop my tray when I fell down to my knees. I couldn’t do that in a million years if I practiced.",https://player.vimeo.com/video/101714345?app_id=122963
https://quantifiedself.com/show-and-tell/?project=375,media  |  stress,Photos,,https://player.vimeo.com/video/35843828?app_id=122963
https://quantifiedself.com/show-and-tell/?project=379,heart rate / cardiovascular,sensor,So I want to share the experience that we have in our center for bio electronics and biosensors at Arizona State University and a spin off from Arizona State.,https://player.vimeo.com/video/81504362?app_id=122963
https://quantifiedself.com/show-and-tell/?project=381,metabolism,Blood glucose monitor | Statwing,"Hi everyone my name is Bob and today I’m going to share with you an experiment I’ve been running for the past few months related to tracking and understanding my glucose. So there’s three questions and obviously we have to stand up her and answer what did we do, how did we do it, and what did we learn. But I want to take a step back and actually answer four, why.",https://player.vimeo.com/video/96591413?app_id=122963
https://quantifiedself.com/show-and-tell/?project=382,sports & fitness,Nike+ FuelBand,"Hello, so I’m here to give a brief talk about the Nike Fuelband. I got one at Christmas. I have no official association with Nike, so definitely don’t take this as an ad.",https://player.vimeo.com/video/96617939?app_id=122963
https://quantifiedself.com/show-and-tell/?project=389,social life & social media  |  stress,Excel | Photos,,https://player.vimeo.com/video/79453884?app_id=122963
https://quantifiedself.com/show-and-tell/?project=398,sports & fitness  |  stress,sensor,,https://player.vimeo.com/video/96617796?app_id=122963
https://quantifiedself.com/show-and-tell/?project=403,media  |  mood & emotion,Excel | sensor,"Hi everyone, my name’s Kiel Gilleade and this is me, or to be precise this is me in 2001. This is a visualization of all the heart data I tracked for a project called body blogger which I presented here back in 2001. This is a heat map during the course of that year.",https://player.vimeo.com/video/97117886?app_id=122963
https://quantifiedself.com/show-and-tell/?project=404,social life & social media,Journal | pen and paper,"Hello everyone, my name is Morris and shortly after turning 40 I was listening to a time management audiobook, and funnily enough this audiobook said I should spend more time thinking on paper.",https://player.vimeo.com/video/98385763?app_id=122963
https://quantifiedself.com/show-and-tell/?project=407,heart rate / cardiovascular  |  sports & fitness,goggles,,https://player.vimeo.com/video/36272221?app_id=122963
https://quantifiedself.com/show-and-tell/?project=423,heart rate / cardiovascular,pen and paper | phone,Get out your pens and start writing down.,https://player.vimeo.com/video/81708431?app_id=122963
https://quantifiedself.com/show-and-tell/?project=424,chronic condition,phone,,https://player.vimeo.com/video/31874427?app_id=122963
https://quantifiedself.com/show-and-tell/?project=426,cognition  |  mood & emotion,Google Sheets | phone,Tracking your brain on booze Boozerlyzer by Caspar Addyman,https://player.vimeo.com/video/35847904?app_id=122963
https://quantifiedself.com/show-and-tell/?project=430,cognition  |  mood & emotion,PACO,,https://player.vimeo.com/video/78071417?app_id=122963
https://quantifiedself.com/show-and-tell/?project=449,chronic condition  |  metabolism,Blood glucose monitor,"So good afternoon, my name is David. I do strategy at Intel Corporate, but I’m here to talk about diabetes as a way of life. I have diabetes. I’ve had diabetes for about 15 years now and I’ll tell you at Quantify Self you can imagine my diagnosis. Sold diabetes Type I is really the interplay of as a way of life, and interplay between carbs, your blood sugar, and the amount of insulin you inject. So by design you know way before the term was coined, it’s considered to be Quantified Self examples.",https://player.vimeo.com/video/69815793?app_id=122963
https://quantifiedself.com/show-and-tell/?project=450,productivity,Lift,day.,https://player.vimeo.com/video/89497779?app_id=122963
https://quantifiedself.com/show-and-tell/?project=454,sports & fitness,VO2Max,"Okay so I know that Steve was interested in hearing about this and I’m sure a couple of other people will be as well. I’m Dave Miller, I’m a competitive cyclist and also a student at MY getting my master’s degree in persuasive technology, so how can technology influence behaviour hopefully for positive ends. And as a competitive cyclist I was interested in getting  a VO2Max test, which assesses your potential.",https://player.vimeo.com/video/22780280?app_id=122963
https://quantifiedself.com/show-and-tell/?project=462,diet and weight loss  |  sports & fitness,Runkeeper | Strava,"Hi, I’m Adrienne and I’m going to tell you about my unwitting participation in a Quantified Self experiment. So we’re going to start with a little bit of a background around energy store and metabolism.",https://player.vimeo.com/video/96595258?app_id=122963
https://quantifiedself.com/show-and-tell/?project=468,heart rate / cardiovascular,Fitbit | Polar Loop,"My talk is about visualizing heart rate data and I will talk about a possible way to represent measure daily values with a curve that could also be used as a baseline for comparisons. But first, a little bit of an introduction.",https://player.vimeo.com/video/103711749?app_id=122963
https://quantifiedself.com/show-and-tell/?project=470,mood & emotion,750 Words | google forms | Journal,Good morning. My name is Dana Greenfield and I’m giving a talk which is called Leaning into Grief and I would like to thank Gary for inviting me here today to share my story.,https://player.vimeo.com/video/96591406?app_id=122963
https://quantifiedself.com/show-and-tell/?project=472,diet and weight loss  |  food tracking  |  productivity,Fitbit,Justin Foo - 15 Weeks of Self Tracking - 40 Pounds Lost,https://player.vimeo.com/video/49707940?app_id=122963
https://quantifiedself.com/show-and-tell/?project=479,chronic condition,pen and paper,"Hi I didn’t expect to be talking today, so this will be a talk that I gave on Monday in London and a preview of the talks that I will give that I will give to Medicine Ex on Friday, but also from the talk that I gave from the QS Amsterdam in May, so here goes.",https://player.vimeo.com/video/75622923?app_id=122963
https://quantifiedself.com/show-and-tell/?project=483,productivity,Fitbit | pen and paper,I’m Anne Prahl doing a Ph.D. researcher at the University of Arts at London exploring wearable devices in textiles. So today I’m here to share with you how I really got into Qualified Self and how I have used self-tracking to inspire my research project and hopefully contribute to it a little bit as well.,https://player.vimeo.com/video/68775423?app_id=122963
https://quantifiedself.com/show-and-tell/?project=485,productivity,Google | pen and paper,Debbie Chaves A Librarian in Numbers,https://player.vimeo.com/video/100583399?app_id=122963
https://quantifiedself.com/show-and-tell/?project=495,heart rate / cardiovascular  |  stress,phone,,https://player.vimeo.com/video/84389057?app_id=122963
https://quantifiedself.com/show-and-tell/?project=497,diet and weight loss  |  food tracking,23andMe,,https://player.vimeo.com/video/98792886?app_id=122963
https://quantifiedself.com/show-and-tell/?project=499,productivity,HoursTracker | phone,,https://player.vimeo.com/video/80968838?app_id=122963
https://quantifiedself.com/show-and-tell/?project=502,money,Mint | You Need a Budget,,https://player.vimeo.com/video/101739500?app_id=122963
https://quantifiedself.com/show-and-tell/?project=503,chronic condition,Journal,,https://player.vimeo.com/video/85097277?app_id=122963
https://quantifiedself.com/show-and-tell/?project=510,sports & fitness  |  stress,tinke,Tinké and this is a very small device over here and what I learned from using Tinké .,https://player.vimeo.com/video/79453885?app_id=122963
https://quantifiedself.com/show-and-tell/?project=513,mood & emotion,Mood Tracker,,https://player.vimeo.com/video/52234514?app_id=122963
https://quantifiedself.com/show-and-tell/?project=514,cognition  |  sleep,Blood glucose monitor | zeo,"For quite a while I’ve been suffering from consistent fatigue and mental fog, and I wasn’t quite sure what it was and then about two years ago I was diagnosed with sleep apnea. So I’ve been treating that with a CPAP and it’s not been too helpful as (I’ve mental signs again?), it hasn’t produced, you know I don’t feel like I did when I was 20.",https://player.vimeo.com/video/59693913?app_id=122963
https://quantifiedself.com/show-and-tell/?project=517,diet and weight loss  |  food tracking  |  stress,Phillips exercise tracker | scale,,https://player.vimeo.com/video/36274355?app_id=122963
https://quantifiedself.com/show-and-tell/?project=521,productivity,Excel | Good Reads,,https://player.vimeo.com/video/85851221?app_id=122963
https://quantifiedself.com/show-and-tell/?project=529,productivity,RescueTime,"Yes, well this is easy because it requires no response. Binary is the next easiest so like did you do it, or did you not do it, and then there’s the you know how many hours of meaningful work did you have to day, which is almost impossible to answer.",https://player.vimeo.com/video/31403630?app_id=122963
https://quantifiedself.com/show-and-tell/?project=530,chronic condition  |  heart rate / cardiovascular,finger clip machine,Century so that’s quite a long time. But it was discovered by the Framingham Heart Study and maybe you’ve heard it because that’s the same study that has discovered cholesterol and blood pressure as respect for cardiovascular health 50 years ago.,https://player.vimeo.com/video/69615435?app_id=122963
https://quantifiedself.com/show-and-tell/?project=534,diet and weight loss  |  food tracking,Excel,,https://player.vimeo.com/video/36268307?app_id=122963
https://quantifiedself.com/show-and-tell/?project=536,mood & emotion  |  social life & social media,Photos,"What is interesting as we’re just drowning in this sea of information, the ability to collect this information is a lot cheaper. All of us are walking around with these little devices, we’re all generating this sort of data exhaust, and everybody in this room knows about this but the fact that we are now able to see patterns and understand things is that this data was always there, but we’re now able to have a new sort of understanding to what this means.",https://player.vimeo.com/video/37869516?app_id=122963
https://quantifiedself.com/show-and-tell/?project=538,chronic condition  |  stress,Excel,I’ve spent the last four years thinking about variations on that fantastic quote of how do we disseminate what we’ve learned. And I find sometimes that it’s difficult for me personally even although I’ve got a decade or more training as a scientist to take an example and apply it in my own context.,https://player.vimeo.com/video/77503681?app_id=122963
https://quantifiedself.com/show-and-tell/?project=548,social life & social media,Photos,"Street station. This is a picture of Bart station, and this is a picture of the ELUA Hotel, which I just love and have to take a photo almost every time I go by, and user license agreement.",https://player.vimeo.com/video/75620036?app_id=122963
https://quantifiedself.com/show-and-tell/?project=549,food tracking  |  sleep,clock | phone,,https://player.vimeo.com/video/35872291?app_id=122963
https://quantifiedself.com/show-and-tell/?project=550,productivity,Data Sense,"Hi I’m Dawn. I’m an anthropologist who’s been studying QS for a little while now, and one of the things that happened in doing that is that it changed my assumptions and my stereotypes about what working with data’s really like.",https://player.vimeo.com/video/96158932?app_id=122963
https://quantifiedself.com/show-and-tell/?project=551,sleep  |  social life & social media,zeo,"I’m Eri, nice to meet you, and I am talking about social studies. This is like Quantified Self but Quantified Us, so I pushed the boundaries a little bit to make it not just about an individual, because we’ve already talked about how motivation changes when other people are in the game and it’s the same for me.",https://player.vimeo.com/video/28735663?app_id=122963
https://quantifiedself.com/show-and-tell/?project=553,diet and weight loss  |  stress,phone | SleepCycle,,https://player.vimeo.com/video/77972738?app_id=122963
https://quantifiedself.com/show-and-tell/?project=563,food tracking  |  sleep,Mymee,Thomas Blomseth - Debugging My Allergy,https://player.vimeo.com/video/33126338?app_id=122963
https://quantifiedself.com/show-and-tell/?project=574,sleep,phone | sensor,Laurie Frick Experiments in Self-Tracking,https://player.vimeo.com/video/97117881?app_id=122963
https://quantifiedself.com/show-and-tell/?project=576,chronic condition,Notes | pen and paper,"Stefan Hoevenaar My Father, a Quantified Diabetic",https://player.vimeo.com/video/100583401?app_id=122963
https://quantifiedself.com/show-and-tell/?project=578,mood & emotion  |  stress,Taplog,Paul LaFontaine We Never Fight on Wednesday,https://player.vimeo.com/video/101714346?app_id=122963
https://quantifiedself.com/show-and-tell/?project=581,diet and weight loss  |  metabolism,test strip,Robert Rothfarb -Tracking my Blood Anticoagulation Drug,https://player.vimeo.com/video/84389058?app_id=122963
https://quantifiedself.com/show-and-tell/?project=582,social life & social media,Measured Me,Konstantin Augemberg - 100 Days of Summer,https://player.vimeo.com/video/79776556?app_id=122963
https://quantifiedself.com/show-and-tell/?project=590,mood & emotion,Fitbit,CBT,https://player.vimeo.com/video/66544671?app_id=122963
https://quantifiedself.com/show-and-tell/?project=591,productivity,Excel,For me doing is a form of knowing- triggering my actions with data by Denis Harscoat,https://player.vimeo.com/video/35965906?app_id=122963
https://quantifiedself.com/show-and-tell/?project=592,sports & fitness,observation,Mark Moschel - Can a 5’7” Person Learn to Dunk a Basketball,https://player.vimeo.com/video/85097278?app_id=122963
https://quantifiedself.com/show-and-tell/?project=597,chronic condition  |  diet and weight loss,Excel,Brain Optimization,https://player.vimeo.com/video/100057325?app_id=122963
https://quantifiedself.com/show-and-tell/?project=598,sports & fitness,Garmin GPS | pedometer,"I’m Julie Price and I have been tracking my running mileage for the past 10 years, while training for 15 marathons. Over this time I have iterated my planning, and tracking and training, and I’m going to talk you through what I learned.",https://player.vimeo.com/video/79674486?app_id=122963
https://quantifiedself.com/show-and-tell/?project=603,chronic condition  |  mood & emotion,sensor | test strip,"My name is Nancy Dougherty and I’m here to talk to you a little bit about my detox from all things quantified and how much healthier I got doing this and how deeply disturbing that was to me, so it didn’t seem to make any sense.",https://player.vimeo.com/video/82215892?app_id=122963
https://quantifiedself.com/show-and-tell/?project=605,genome & microbiome  |  mood & emotion,Fitbit | pen and paper,"Hi there. I’m Stuart Calimport and I’m going to be talking about memomics and the longevity interaction, so thank you for having me.",https://player.vimeo.com/video/81593666?app_id=122963
https://quantifiedself.com/show-and-tell/?project=607,diet and weight loss  |  sports & fitness,Google | Journal,Richard Harrison - How I Lost 200 Lbs,https://player.vimeo.com/video/83272870?app_id=122963
https://quantifiedself.com/show-and-tell/?project=610,diet and weight loss  |  food tracking,Notes | Photos,Weight loss trough embodied learning by Robin Barooah,https://player.vimeo.com/video/36270681?app_id=122963
https://quantifiedself.com/show-and-tell/?project=613,diet and weight loss  |  food tracking,Excel,Dan Dascalescu - A 30 Day Trial of the Slow Carb Diet,https://player.vimeo.com/video/83272869?app_id=122963
https://quantifiedself.com/show-and-tell/?project=619,cognition,chart | sensor,Adam Laughlin - Inside - Boston QS,https://player.vimeo.com/video/85851222?app_id=122963
https://quantifiedself.com/show-and-tell/?project=620,chronic condition  |  productivity,Excel,,https://player.vimeo.com/video/96616926?app_id=122963
https://quantifiedself.com/show-and-tell/?project=622,diet and weight loss  |  sports & fitness,Fitbit | phone,"I would like to start with a few words about myself. I’m a maker and I like to build stuff and build devices, sensor devices and collect and analyze data and I’m very data curious. I also blog about the Internet Of Things. So this means I spend a lot of time sitting in front of a computer and combined with the fact I work at home, this is really bad for my health. People in the US say that sitting is the new smoking and it can turn very bad for you directly or indirectly. For me the direct negative effects is the fact that I’ve been getting a lot of weight for the last 10 years since I graduated and started working, plus the fact that my blood cholesterol is raising and abnormal for my age.",https://player.vimeo.com/video/69815248?app_id=122963
https://quantifiedself.com/show-and-tell/?project=623,cognition  |  social life & social media,sticky notes | Word,"I am on a quest to experience as much in life as possible, and I’m here to share a bit of that story, if that’s okay with you. You can find me at @jamesnorris_ on Twitter.",https://player.vimeo.com/video/106520298?app_id=122963
https://quantifiedself.com/show-and-tell/?project=628,cognition  |  media,meme | video clip,Robert DeSaulniers - Tracking a Memetic Diet - Boston QS,https://player.vimeo.com/video/96775693?app_id=122963
https://quantifiedself.com/show-and-tell/?project=631,social life & social media,phone | Saga,Kitty Ireland - Grandma Was A Lifelogger,https://player.vimeo.com/video/78251001?app_id=122963
https://quantifiedself.com/show-and-tell/?project=633,diet and weight loss  |  social life & social media,scale,Steve Dean Tracking over Time,https://player.vimeo.com/video/99536156?app_id=122963
https://quantifiedself.com/show-and-tell/?project=638,media,Photos | video clip,Roger Craig - Knowledge Tracking,https://player.vimeo.com/video/29001512?app_id=122963
https://quantifiedself.com/show-and-tell/?project=639,social life & social media,Fitbit | foursquare,Lee Rogers Why Annual Reporting,https://player.vimeo.com/video/102150945?app_id=122963
https://quantifiedself.com/show-and-tell/?project=640,cognition  |  mood & emotion,EEG (Electroencephalography) | phone,My experience with a smartphone brainscanner by Jakob Eg Larsen,https://player.vimeo.com/video/35842257?app_id=122963
https://quantifiedself.com/show-and-tell/?project=641,chronic condition  |  metabolism,Blood glucose monitor | Notes,Brooks Kincaid - A Diabetic's Experiment with Self Quantification,https://player.vimeo.com/video/54881152?app_id=122963
https://quantifiedself.com/show-and-tell/?project=642,mood & emotion  |  stress,O.Zen | sensor,Olivier Janin - Playing with my Breath,https://player.vimeo.com/video/82754630?app_id=122963
https://quantifiedself.com/show-and-tell/?project=646,chronic condition  |  food tracking,Mymee | pen and paper,Thomas Christiansen - Debugging My Allergy,https://player.vimeo.com/video/31874584?app_id=122963
https://quantifiedself.com/show-and-tell/?project=647,productivity  |  social life & social media,Google Calendar,Catherine Hooper - Hour-Tracking for Priority Optimization,https://player.vimeo.com/video/32106581?app_id=122963
https://quantifiedself.com/show-and-tell/?project=648,diet and weight loss  |  sports & fitness,Fitbit | scale,Bill Schuller - QS Adventures with my Kids,https://player.vimeo.com/video/82754629?app_id=122963
https://quantifiedself.com/show-and-tell/?project=652,sports & fitness  |  stress,light box | simulation device,Josh Berson Cartographies of Vigilance,https://player.vimeo.com/video/100986322?app_id=122963
https://quantifiedself.com/show-and-tell/?project=660,media,meme,Chris Dancy - Data Cartography The Journey to Existence Mapping,https://player.vimeo.com/video/77972739?app_id=122963
https://quantifiedself.com/show-and-tell/?project=668,social life & social media,Journal | Photos,Hi I’m Karen Herzog and this is Richard Sachs my husband and we’re going to share Sophia’s story with you.,https://player.vimeo.com/video/14282114?app_id=122963
https://quantifiedself.com/show-and-tell/?project=669,mood & emotion  |  sports & fitness,Journal,Troy Angrignon - QS Tools for Military Style Training,https://player.vimeo.com/video/63277770?app_id=122963
